title,description,event_type,location,start_date,end_date,max_participants,is_active,organizer_id
Kanyama Community Cleanup,Major cleanup along Kanyama main road. Bring gloves and bags. Refreshments provided.,cleanup,Kanyama Compound Main Road Lusaka,2024-12-15 07:00:00,2024-12-15 11:00:00,150,1,1
Kalingalinga Recycling Workshop,Learn practical recycling and meet local recyclers. Free training materials.,workshop,Kalingalinga Community Hall,2024-12-20 14:00:00,2024-12-20 17:00:00,60,1,1
Chawama Waste Sorting Training,Hands-on training for proper household waste sorting,workshop,Chawama Market Area,2024-12-18 09:00:00,2024-12-18 12:00:00,50,1,1
Lusaka Eco Competition Finals,Annual environmental competition with cash prizes and certificates,competition,Olympic Youth Development Centre,2024-12-28 09:00:00,2024-12-28 16:00:00,200,1,1
Soweto Market Cleanup,Early morning cleanup with market vendors. Free breakfast after cleanup.,cleanup,Soweto Market Lusaka,2024-12-22 05:30:00,2024-12-22 09:30:00,100,1,1
Compound Leaders Summit,Training for community leaders from Kanyama Kalingalinga and Chawama on waste management,campaign,Lusaka Civic Centre,2024-12-27 10:00:00,2024-12-27 15:00:00,80,1,1
